{
  "capability_id": "android.testing",
  "label": "Android Testing",
  "schema_version": "2.0",
  "updated_at": "2026-06-18T00:55:01Z",
  "knowledge": {
    "entries": []
  },
  "antipatterns": {
    "entries": []
  },
  "playbooks": {
    "entries": []
  },
  "benchmarks": {
    "entries": []
  },
  "regression_signals": [],
  "compression_profile": {
    "tier1_max_tokens": 200,
    "tier2_max_tokens": 800
  },
  "health": {
    "computed_at": "2026-06-18T00:55:01Z",
    "proven_patterns": 0,
    "experimental_patterns": 0,
    "active_antipatterns": 0,
    "proven_antipatterns": 0,
    "playbook_count": 0,
    "benchmark_count": 0,
    "prevented_failures": 0,
    "last_regression": null,
    "trend": "sparse",
    "memory_quality": "sparse"
  }
}
